url,product_id,product_name,product_category,summary,reviews,ratings,dates,sentiment_scores,compound,sentiment,topic
https://www.amazon.in/Amazon-Basics-Adjustable-Thermostat-certified/dp/B09ZTZ9N3Q/ref=sr_1_86?qid=1672923595&s=kitchen&sr=1-86,B09ZTZ9N3Q,"Amazon Basics 2000/1000 Watt Room Heater with Adjustable Thermostat (ISI certified, White color, Ideal for small to medium room/area)","Home&Kitchen|Heating,Cooling&AirQuality|RoomHeaters|FanHeaters","Found 8 reviews, 39 ratings, and 8 dates.","The media could not be loaded.
                
            
                
            
            
        
    
    








  
  
    Product not working, please replace it. | Please don't bye it, I ordered this Amazon basics room heater, it running well for two months and suddenly stop working when I want to claim my 1 year warrenty, their customer card service is really sucks, when I called customer service, first it is told that "" You have to register warrenty first "" Then I register my warrenty and it takes 3 days to register and then I apply for my warrenty, they told me to email at Amazon brand email, and now such disaster started, they told me on email it takes 7 days to process my warrenty, and till date 24 days from my complain register, and i don't get my warrenty till date, so please don't bye it....... | Good & practically useful. | This product is too better in this price segment and yes it helps very well in extreme cold weather condition... But make sure you are using it inside the room otherwise it will not effective as it could be🤧✌️ | Don't go for negative comments, if you get this in below 800 the go for it, it is worth of money, the only problem is with thermostats which Don't allow to increase or decrease. | The unit comes only with 15 plug. So cannot be used in room that does not have a 15 amp plug.  So was useless for me. | Aur bahut achha aur tikau | The media could not be loaded.
                
            
                
            
        
    
    








  
  
    As it was not working efficiently,so i returned, but exchanged product Is also with same problem.No improvement in product quality.1000 w heater is not enough to make you warm.It's only for 30 to 50 sqft area, it's not suitable for 10 x10 room.",3.7 out of 5 stars | Previous page of related Sponsored Products | Next page of related Sponsored Products | Previous set of slides | 4.1 out of 5 stars | 4.1 out of 5 stars | 4.0 out of 5 stars | 3.3 out of 5 stars | 3.9 out of 5 stars | Next set of slides | Previous set of slides | 3.3 out of 5 stars | 4.0 out of 5 stars | 4.2 out of 5 stars | 3.7 out of 5 stars | 3.4 out of 5 stars | 3.3 out of 5 stars | Next set of slides | Previous page of related Sponsored Products | Next page of related Sponsored Products | 3.7 out of 5 stars | 5.0 out of 5 stars | 3.9 out of 5 stars | 4.5 out of 5 stars | 4.0 out of 5 stars | 4.1 out of 5 stars | 3.7 out of 5 stars | 5.0 out of 5 stars | Previous page | Next page | 4 out of 5 stars | 5.0 out of 5 stars | 1.0 out of 5 stars | 4.0 out of 5 stars | 5.0 out of 5 stars | 5.0 out of 5 stars | 3.0 out of 5 stars | 5.0 out of 5 stars | 1.0 out of 5 stars,Reviewed in India on 31 December 2022 | Reviewed in India on 1 January 2023 | Reviewed in India on 5 July 2023 | Reviewed in India on 26 January 2023 | Reviewed in India on 17 January 2023 | Reviewed in India on 28 January 2023 | Reviewed in India on 10 October 2023 | Reviewed in India on 28 December 2022,"{'neg': 0.09, 'neu': 0.814, 'pos': 0.096, 'compound': -0.0721}",-0.0721,negative,4
https://www.amazon.in/Bajaj-Delux-2000-Watt-Room-Heater/dp/B009P2LK80/ref=sr_1_103?qid=1672923596&s=kitchen&sr=1-103,B009P2LK80,"Bajaj Deluxe 2000 Watts Halogen Room Heater (Steel, ISI Approved), Multicolor","Home&Kitchen|Heating,Cooling&AirQuality|RoomHeaters|HalogenHeaters","Found 8 reviews, 51 ratings, and 8 dates.","Product is very good and sturdy, size is perfect, safety is very good temperature control is good, light weight, easy to carry around house.Value for money product.👍 | Working fine, reflection is too good to distribute heat around | This is the best, and everything that the product description says. It has two modes, quite discrete, unlike a fan regulator. So the lower mode is 1000W and the second one is 2000W and for most of the Nov and Dec north winters, it will work for a 1 closed room. 2000W is a little too much for one room but can work fine for a hall/living area or a bigger room. It is indeed lightweight and makes zero noise. It is literally a modern Bhatti, electric angeethi and digital aalaav. It's fire in the room without the worry of any fire hazard emergency. | The Bajaj Deluxe Room Heater 2000Watt, despite its promise of a 2-year warranty, fell short of expectations. Within just six months of use, functionality issues arose, highlighting a lack of durability. Upon reporting a defect with the tuning knob, customer service was initially responsive, but subsequent delays in resolving the issue have been frustrating. Despite assurances from technicians regarding replacement parts, nearly 40 days have passed with no resolution in sight. This experience has severely undermined Bajaj Electricals' reputation as a reliable brand in India. As a result, I am disillusioned and vow not to purchase any Bajaj products in the future, nor would I recommend them to others. | Very goodGood performance and quality is also too good. Love this product .thank you Amazone for this good product | I like the switch system. It has replaced old system of switch making it more easy to use. However, it stands started getting loose very soon as a result the heater rotate itself and fall down to floor. It can cause fire accident if not careful. One of the coil also suddenly started emitting spark. I tighten it in time otherwise it could have broken down very early. One of the cover ring also got disconnected from it main body. I wonder whether this is original Bajaj product or not. | Always trusted bajaj. Best to keep the room warm, but sure light bill will come as per your use. Use two rod and you will start to sweat. | Bad product produced by bajaj, in 1 year both roads were destroyed.",3.9 out of 5 stars | Previous page | Next page | Previous page | Next page | Previous page | 4.0 | 4.2 | 3.9 | Next page | Previous page of related Sponsored Products | Next page of related Sponsored Products | Previous set of slides | 3.8 out of 5 stars | 4.0 out of 5 stars | 4.1 out of 5 stars | 4.0 out of 5 stars | 3.8 out of 5 stars | 4.1 out of 5 stars | Next set of slides | 3.9 out of 5 stars | Previous page | 4.1 out of 5 stars | 4.2 out of 5 stars | 3.6 out of 5 stars | 4.0 out of 5 stars | 3.5 out of 5 stars | Next page | Previous page of related Sponsored Products | Next page of related Sponsored Products | 3.9 out of 5 stars | 3.8 out of 5 stars | 4.1 out of 5 stars | 4.1 out of 5 stars | 4.3 out of 5 stars | 4.1 out of 5 stars | 3.9 out of 5 stars | 5.0 out of 5 stars | Previous page | Next page | 4 out of 5 stars | 5.0 out of 5 stars | 4.0 out of 5 stars | 5.0 out of 5 stars | 1.0 out of 5 stars | 1.0 out of 5 stars | 5.0 out of 5 stars | 3.0 out of 5 stars | 5.0 out of 5 stars | 4.0 out of 5 stars | 4.0 out of 5 stars,Reviewed in India on 18 August 2024 | Reviewed in India on 24 June 2024 | Reviewed in India on 23 December 2023 | Reviewed in India on 8 February 2024 | Reviewed in India on 11 April 2024 | Reviewed in India on 30 January 2024 | Reviewed in India on 8 February 2024 | Reviewed in India on 30 January 2024,"{'neg': 0.149, 'neu': 0.697, 'pos': 0.154, 'compound': -0.1882}",-0.1882,negative,1
https://www.amazon.in/Remover-Clothes-Extractor-Battery-Removing/dp/B09JN37WBX/ref=sr_1_121?qid=1672923596&s=kitchen&sr=1-121,B09JN37WBX,Lint Remover Woolen Clothes Lint Extractor Battery Lint Removing Machine Bhur Remover,"Home&Kitchen|Kitchen&HomeAppliances|Vacuum,Cleaning&Ironing|Irons,Steamers&Accessories|LintShavers","Found 8 reviews, 42 ratings, and 8 dates.","Can easily remove lint from my woolen clothes with the help of this in no time . | Bought it second time. First was with wire to which the motor got burnt very soon. And couldnot find any replacement. Now bought this one with 2 AA sized batteries. Working good but i wont think it would work longer | Its a wireless machine. Very convenient and easy to use | THE PRODUCT IS VERY USEFUL HAVEN'T BELIEVE UNTILL I'VE TRIED IT ,BUT THE ONLY COMPLAINT IS I GOT A USED PRODUCT AND IT WAS DEFECTIVE THE CAP WAS BROKEN ND THE BLADE'S WERE LOOSE SOME HOW I MANAGE TO FIX THE BLADE'S BUT THE CAP WAS BROKEN FROM SIDE , YOU SHOULD HAVE REPLACE THE CAP BEFORE SENDING TO CUSTOMER OR TOOK LESS MONEY FOR DEFECTIVE PRODUCTS 😐😐 | Very bad | Works on batteries, light weight, pocket friendly. Easy lint removal. | It works wonder | One of the best product. It works so smooth.Fully satisfied with the product",3.9 out of 5 stars | Previous page | Next page | Previous page of related Sponsored Products | Next page of related Sponsored Products | Previous set of slides | 3.6 out of 5 stars | 4.3 out of 5 stars | 4.0 out of 5 stars | 4.3 out of 5 stars | 4.0 out of 5 stars | 4.0 out of 5 stars | Next set of slides | Previous page | 4.2 out of 5 stars | 3.9 out of 5 stars | 4.3 out of 5 stars | 3.9 out of 5 stars | 4.2 out of 5 stars | Next page | Previous page of related Sponsored Products | Next page of related Sponsored Products | 3.9 out of 5 stars | 4.1 out of 5 stars | 4.4 out of 5 stars | 4.2 out of 5 stars | 4.1 out of 5 stars | 4.3 out of 5 stars | 3.9 out of 5 stars | 5.0 out of 5 stars | Previous page | Next page | 4 out of 5 stars | 5.0 out of 5 stars | 4.0 out of 5 stars | 5.0 out of 5 stars | 3.0 out of 5 stars | 3.0 out of 5 stars | 1.0 out of 5 stars | 5.0 out of 5 stars | 4.0 out of 5 stars | 5.0 out of 5 stars,Reviewed in India on 11 June 2024 | Reviewed in India on 12 January 2024 | Reviewed in India on 24 December 2023 | Reviewed in India on 11 January 2023 | Reviewed in India on 4 October 2024 | Reviewed in India on 28 December 2023 | Reviewed in India on 24 August 2024 | Reviewed in India on 16 January 2024,"{'neg': 0.169, 'neu': 0.665, 'pos': 0.165, 'compound': -0.4282}",-0.4282,negative,4
https://www.amazon.in/White-Feather-Portable-Sealing-Multicolor/dp/B0BMFD94VD/ref=sr_1_143?qid=1672923597&s=kitchen&sr=1-143,B0BMFD94VD,"White Feather Portable Heat Sealer Mini Sealing Machine for Food Storage Vacuum Bag, Chip, Plastic, Snack Bags, Package Home Closer Storage Tool (Multicolor) Random Colour",Home&Kitchen|Kitchen&HomeAppliances|SmallKitchenAppliances|VacuumSealers,"Found 8 reviews, 34 ratings, and 8 dates.","Dont waste your money over this. I bought one, didnt seal anything so i replaced it. The second one didnt work either. You should buy them packet clips. Also, the refund came back after 40 days. Not worth a penny | Not worth the price.....doesn't work at all, airtight feature is just not adequate.....Dont buy this product | Its very useful .. loved it | Useless. Utter failure. Money wasted. | It's important  to note that once you order and product delivered ,it can't  be returned  but only replaced .it doesn't  function  as it says .it seals plastic only not that good .it doesn't  seal polished printed covers as in packs of haldiram . | The product doesn't work at all and the return order was never executed. | Not working properly loss of money | The media could not be loaded.
                
            
                
            
            
        
    
    








  
  
    Not usseing properly",2.1 out of 5 stars | Previous page of related Sponsored Products | Next page of related Sponsored Products | Previous set of slides | 3.7 out of 5 stars | 4.2 out of 5 stars | 3.9 out of 5 stars | 3.9 out of 5 stars | 1.9 out of 5 stars | 3.9 out of 5 stars | Next set of slides | Previous set of slides | 4.1 out of 5 stars | 3.4 out of 5 stars | 3.6 out of 5 stars | 3.5 out of 5 stars | 3.9 out of 5 stars | 4.4 out of 5 stars | Next set of slides | Previous page of related Sponsored Products | Next page of related Sponsored Products | 2.1 out of 5 stars | 5.0 out of 5 stars | Previous page | Next page | 1 out of 5 stars | 1.0 out of 5 stars | 1.0 out of 5 stars | 5.0 out of 5 stars | 1.0 out of 5 stars | 2.0 out of 5 stars | 1.0 out of 5 stars | 1.0 out of 5 stars | 1.0 out of 5 stars,Reviewed in India on 13 February 2023 | Reviewed in India on 14 January 2023 | Reviewed in India on 28 January 2023 | Reviewed in India on 1 October 2023 | Reviewed in India on 13 January 2023 | Reviewed in India on 31 January 2023 | Reviewed in India on 14 January 2023 | Reviewed in India on 28 December 2022,"{'neg': 0.082, 'neu': 0.848, 'pos': 0.07, 'compound': -0.1871}",-0.1871,negative,0
https://www.amazon.in/Portable-Hairball-Epilator-Removing-Furniture/dp/B09XB1R2F3/ref=sr_1_157?qid=1672923598&s=kitchen&sr=1-157,B09XB1R2F3,"Portable Lint Remover Pet Fur Remover Clothes Fuzz Remover Pet Hairball Quick Epilator Shaver Removing Dust Pet Hair from Clothing Furniture Perfect for Clothing,Furniture,Couch,Carpet (Standard)","Home&Kitchen|Kitchen&HomeAppliances|Vacuum,Cleaning&Ironing|Irons,Steamers&Accessories|LintShavers","Found 8 reviews, 31 ratings, and 8 dates.","The plastic is of low quality. The metal comb part is horrible. It would damage any of your hardest carpets easily. Cleaning sofa with this product will leave you with regrets. The handle comes off while cleaning. Cannot be even qualified as 'kid's toy'.Moreover, it was not returnable. I had ordered 2 of them and thought to return it. But as I did not have that option I chose to exchange them. But after returning 2 products I only got 1 in exchange. Like... WTH...one for the prize of 2🤷‍♀️😤 I wrote a mail regarding this to Amazon and got no reply!!! 😡😡The item sent in exchange was awful than that I received in the beginning.A total waste of money... Never ever buy this product. ❌❌ | Very usefulQuality is goodBest for pet parents ❤️ | it is effective but the quality is extremely poor... they should work hard to improve quality.. this pic has been taken within an hour of delivery | It works magic on cloth lints! | Not worth your money | Not worth trying out this product. Broke in 1 use and absolutely doesn't do the job its supposed to | This works perfectly to remove my dogs hair from sofa and chairs. It gathered even the smallest hair. Awesome product. | Does not qualify for a single star. Worst product made of 3rd grade plastc, the handle was broken when received. Does not serve any purpose.",2.9 out of 5 stars | Previous page | Next page | 3.0 | 2.5 | 2.0 | 1.9 | Previous page of related Sponsored Products | Next page of related Sponsored Products | Previous page of related Sponsored Products | Next page of related Sponsored Products | 2.9 out of 5 stars | 4.2 out of 5 stars | 4.0 out of 5 stars | 4.2 out of 5 stars | 4.0 out of 5 stars | 4.1 out of 5 stars | 2.9 out of 5 stars | 5.0 out of 5 stars | Previous page | Next page | 3 out of 5 stars | 1.0 out of 5 stars | 5.0 out of 5 stars | 3.0 out of 5 stars | 3.0 out of 5 stars | 4.0 out of 5 stars | 2.0 out of 5 stars | 1.0 out of 5 stars | 5.0 out of 5 stars | 1.0 out of 5 stars,Reviewed in India on 8 June 2024 | Reviewed in India on 4 March 2024 | Reviewed in India on 20 February 2023 | Reviewed in India on 24 April 2023 | Reviewed in India on 20 January 2023 | Reviewed in India on 14 August 2023 | Reviewed in India on 18 November 2022 | Reviewed in India on 7 October 2023,"{'neg': 0.147, 'neu': 0.75, 'pos': 0.103, 'compound': -0.7824}",-0.7824,negative,0
https://www.amazon.in/Eureka-Forbes-Amaze-RO-MTDS/dp/B07YC8JHMB/ref=sr_1_223?qid=1672923603&s=kitchen&sr=1-223,B07YC8JHMB,"Aquasure From Aquaguard Amaze RO+UV+MTDS,7L storage water purifier,suitable for borewell,tanker,municipal water (Grey) from Eureka Forbes",Home&Kitchen|Kitchen&HomeAppliances|WaterPurifiers&Accessories|WaterFilters&Purifiers,"Found 4 reviews, 38 ratings, and 4 dates.","Review as of 31/5/20211. Shopping & delivery:  Good. Got product delivered in 2-3 days2. Installation: installed on the same day as promised by the technician and managerial team due to earlier experience of need for return of Aquasure SmartPlus. Good service overall. Polite technician. Explained stuff well.3. Product Review: Water taste is also not bad. So far it's working well and fine (used for 2 days now)A. Pros: *  Fills water in the tank (7 L) fast. *  Can be wall mounted / table top as required. *  Size is manageable only. *  Silent operation *  Value for moneyB. Cons: *  Water wastage is pretty high as other RO devices.  May be more water is wasted than purified. *  The tap provided to take water is not comfortable.  Water spills everytime you close the tap after  filling up the cup/bottle/whatever.Will be updated if need arises. | I rarely post review but I think this review might help you with your decision if you want to buy this purifier or not.The Purifier works fine. However it seems its better suited to places where there is no water pressure and water supply issue.I will provide review on basic things which make a purifier good.i) Installation - Was done by AG guy and seems not too troublesome. Will see if it changes in case I move.ii) Storage Capacity - It seems just enough, but for a family 2-3 people, in summers, this capacity is not enough.iv) Servicing - My purifier once stopped working on Sunday morning so called AG guy and I had to wait for another day for the visit as Sunday was off day. It eventually started working before the visit, so the visit didn't add anything. [UPDATE ON SERVICING]: I think the servicing day issue was due to COVID pandemic, and I have been told they will be available to service the purifier on both days of weekend as well. So that should put your mind at ease about servicing.Last and most important:v) Purifying mechanism - Its a little cumbersome and takes time to know how this thing works. so know this, it works best if water enters in full flow to purifier inlet. The LED 2nd from top which says ""Purifying"" flickers at a frequency depending on pressure. If there is very low pressure, the LED will beep at every 6-8 seconds and might even not been at all. If its medium pressure, it will beep at every 2-3 seconds. And if pressure is good/high, it will do continuous beep without flicker.Here are some issues or hints (depends) to help you know the working of this purifier.i) Problem 1 - There is no way to make it purify faster if flow pressure is low.ii) Problem 2 - Once pressure is too low the purifier will stop purifying, but once pressure comes back, many a times it won't resume purifying. so you have to switch it off and keep it off till power LED goes off and turn it on again.iii) Problem 3 - with low pressure once purifier stops working, most of the times it needs you to open the tap (and wait till water comes with full force and leave it like that for about 5 seconds and then close the tap) to help it with maintaining minimum necessary water pressure.All above problems occur if your Purifier inlet is set directly on water supply line which will have varying pressure through out the day depending when your home gets water. But if you have a storage before this purifier to feed water to it and that is at sufficient height or have a way to push water with sufficient pressure, you will not face any of the above listed problems.Once you know above three problems and way to workaround them wherever you can, it looks to be a decent purifier. and Generally with every purifier, it takes a little time (couple of weeks) to understand how it works or doesn't work.Hope this review helps. | Update 4th month of use! Don't Buy! Customer service is hollow.a little over a month into purchase, the device started beeping continuously when refilling and just wouldn't stop. the first time we asked for support, nobody showed up for a week, and when they did they said its a new faulty fuse used only in this model and that most products in the city have this fault and are pending. waited three weeks before contacting them for an update, another guy comes to diagnose AGAIN and he doesn't put the device back together again, so now device overflowed and didn't even start had to beg to solve the new problems and leave me with the beeping only problem. , now it has stretched to three months. every time i reach out to customer service to repeat my horror to them of no avail. they try to say that the water is still fit for use, just ignore the beep. is this what we pay for? to be treated like this?------------------------------------------Has been nearly a month now. Installation was delayed by Eureka stating the cause of COVID. Technician didn't test water hardness / suggest the need for a pre-filter as some other reviews mentioned. Out of the box, the unit had some minor scratches and two tiny dents. I considered returning but took a chance with the product since I needed the unit asap. After about 10 days of delivery, was installed, quite professionally with least disturbance to the fittings and all. Everything was explained quite well. There is a diverter valve included in the package to fit with a source. For some reason, this diverter valve broke a couple of days ago, I am not entirely sure if it was a manufacturing defect or the cause of someone using the tab it was installed with. However, I had a tough time finding an after market valve to fit the original tubes. Have obtained an original valve from Eurkea, will have to install it now.The purifier itself is very silent and fast, fills up from empty in nearly 15 minutes, Storage quantity is more than demanded for a family of 5. Quality of water is good, tastes almost like any other RO water. Unit is light in weight and compact. | Good looking product. Tank is transparent to view the water level. Wall mountable, no need for stand. Eureka Forbes technician installed the unit after 2 days of delivery. The technician Mr.Solai was very professional and neatly fitted the system including a pre-filter which is not included in the package. Got pre-filter on additional payment. This RO + UV purifies nicely and the water taste is good. The technician has set the taste by adjusting MTDS. Overall, it's a value for money product.Cons:The water cut off sensor failed within 10 months. I raised a complaint on 7th Apr 2023 but still no response to replace the sensor.5 star for Amazon delivery5 star for installationBut1 star for service",3.9 out of 5 stars | Previous page of related Sponsored Products | Next page of related Sponsored Products | Previous set of slides | 4.4 out of 5 stars | 4.3 out of 5 stars | 4.0 out of 5 stars | 3.9 out of 5 stars | 3.9 out of 5 stars | 4.2 out of 5 stars | Next set of slides | Previous page | 4.5 out of 5 stars | 4.2 out of 5 stars | 4.2 out of 5 stars | 4.5 out of 5 stars | 4.0 out of 5 stars | Next page | Previous page of related Sponsored Products | Next page of related Sponsored Products | 3.9 out of 5 stars | 4.1 out of 5 stars | 4.2 out of 5 stars | 3.9 out of 5 stars | 4.1 out of 5 stars | 4.2 out of 5 stars | 3.9 out of 5 stars | 5.0 out of 5 stars | Previous page | Next page | 3 out of 5 stars | 5.0 out of 5 stars | 5.0 out of 5 stars | 4.0 out of 5 stars | 1.0 out of 5 stars | 1.0 out of 5 stars | 5.0 out of 5 stars | 5.0 out of 5 stars,Reviewed in India on 31 May 2021 | Reviewed in India on 28 May 2020 | Reviewed in India on 28 June 2020 | Reviewed in India on 12 June 2022,"{'neg': 0.112, 'neu': 0.794, 'pos': 0.094, 'compound': -0.9718}",-0.9718,negative,2
