url,product_id,product_name,product_category,summary,reviews,ratings,dates,sentiment_scores,compound,sentiment,topic
https://www.amazon.in/ZEBRONICS-Zeb-Astra-20-Wireless-Rechargeable/dp/B0B12K5BPM/ref=sr_1_93?qid=1672902998&s=computers&sr=1-93,B0B12K5BPM,"ZEBRONICS Zeb-Astra 20 Wireless BT v5.0 Portable Speaker with 10W RMS Output, TWS, 10H Backup Approx, Built in Rechargeable Battery FM Radio, AUX, mSD, USB, Call Function and Dual 52mm Drivers Multi",Electronics|HomeAudio|Speakers|BluetoothSpeakers,"Found 8 reviews, 39 ratings, and 8 dates.","Perfect sound bar at such affordable price, from such reputed zebronics brand. Good sound, sound is clear and loud in 17*10 feet room | Zebronics Astra 30 (Portable BT speaker)First of all, keep in mind the low price of approx ₹1000 of this product (which may even further reduced during Festival Sale times and with Card discounts).Design- it comes in a bar shape and kind of lengthy but that's how it is designed by the company.Quality- this product is of full plastic made and given the low price, this is something which is expected too.Buttons- on Top of the speaker, it has 4 buttons.1st button- to Play/Pause/Scan FM channels2nd button- previous track/long press to Volume down3rd button- next track/long press to Volume up4th button- to Switch modes (BT/Aux/FM etc.)Ports- it has 4 ports and 1 Switch/button at the back.1 port of Aux, USB, Memory card, Type-C (for charging cable) and 1 Switch/button of On/Off to Turn On/Off the SpeakerSound- sound is loud enough (considering the 14W speakers).Sound quality on the other hand could have been better but again, considering the low price, I guess this is expected. Bass and Sound quality is not very bad but also not good enough.Box items- box will have 1 BT speaker, 1 charging cable (USB to Type-C), 1 Aux cableOverall, considering the low price, this product is good.There are few small issues, which could have been solved even at low price.Cable length: both cables (charging and Aux) are smaller in size. You can see in the pic, I have kept the speaker in front of Monitor. I was thinking to keep the Speaker at one end of the table but charging/Aux cables are very small in length and I have to kept it in front of Monitor.So, if you are thinking to connect it to your TV, you will definitely have to purchase a lengthy Aux cable separately. Also, for charging, you will have to place Speaker very close to the charging port, as charging cable is not lengthy.Volume buttons- I personally keep the volume at 60-70% of Speaker, which I keep using the Total press buttons of volume (e g. if volume button has 1-10 press, then I will bring the Volume to Max and press Volume down button 3/4 times). But in this speaker, you have to long press the Volume button and there is no way to know at what level you are. | Great sound | I am appalled & disgusted with this product😤. The quality is subpar and performance is worst. For the price, I expected a decent product but what I got was a worthless piece of junk🗑️ | The soundbox is good but the Aux cable and the charger are pathetic. Zebronics should have provided a better cables. It automatically broke at the bending point after 5-6 months. Now with other cables also it is not charging properly. | N/A | Everything is good but sound should have a little louder. | Good one like boom soundValue for money",3.8 out of 5 stars | Previous page | Next page | Previous page | Next page | Previous page of related Sponsored Products | Next page of related Sponsored Products | 3.8 out of 5 stars | 4.0 out of 5 stars | 3.8 out of 5 stars | 3.7 out of 5 stars | 4.0 out of 5 stars | 4.0 out of 5 stars | 3.8 out of 5 stars | Previous page of related Sponsored Products | Next page of related Sponsored Products | Previous page | 4.2 out of 5 stars | 4.0 out of 5 stars | 4.1 out of 5 stars | 4.4 out of 5 stars | 4.0 out of 5 stars | Next page | 3.8 out of 5 stars | 5.0 out of 5 stars | Previous page | Next page | 4 out of 5 stars | 5.0 out of 5 stars | 4.0 out of 5 stars | 4.0 out of 5 stars | 5.0 out of 5 stars | 1.0 out of 5 stars | 3.0 out of 5 stars | 3.0 out of 5 stars | 5.0 out of 5 stars | 5.0 out of 5 stars | 4.0 out of 5 stars | 5.0 out of 5 stars,Reviewed in India on 16 October 2024 | Reviewed in India on 6 June 2024 | Reviewed in India on 26 September 2024 | Reviewed in India on 5 October 2024 | Reviewed in India on 12 October 2024 | Reviewed in India on 23 September 2024 | Reviewed in India on 14 May 2024 | Reviewed in India on 29 September 2024,"{'neg': 0.095, 'neu': 0.821, 'pos': 0.084, 'compound': -0.7702}",-0.7702,negative,3
https://www.amazon.in/HP-Multimedia-Wireless-Keyboard-4SC12PA/dp/B07V82W5CN/ref=sr_1_203?qid=1672903005&s=computers&sr=1-203,B07V82W5CN,"HP USB Wireless Spill Resistance Keyboard and Mouse Set with 10m Working Range 2.4G Wireless Technology / 3 Years Warranty (4SC12PA), Black","Computers&Accessories|Accessories&Peripherals|Keyboards,Mice&InputDevices|Keyboard&MouseSets","Found 8 reviews, 33 ratings, and 8 dates.","this keyboard mouse combo is the best for the price very good quality writing this review after using it.. | The product is good but  There is no caps lock LED light on the keyboard. When not in use, the mouse automatically stops working. hp should be given a caps lock LED light on the keyboard. no light always confusion. | Outstanding product performance superb durable type material.Last time I received a defective mouse and Bluetooth was not working properly. Then exchange . Now OK. | This product is a complete disappointment. The sensitivity is extremely poor. I bought it a month ago, and it started having issues shortly after. The return window is very short, and getting it serviced would cost more in transportation than the product is worth. It also has a copy-paste problem, and to make matters worse, there’s no Caps Lock indicator light. This wasn't mentioned, but it reflects the outdated design of the product. Many times, it types ""C"" instead of copying the content, which is frustrating, especially when you have to type everything manually. I don't recommend this product for office work; it will irritate you when typing passwords and doing copy-paste tasks. Don’t be swayed by the positive reviews—you might be the next person to receive a faulty product. Beware, and think twice before buying this cheap, low-quality item. | After using one week I find very comfortable to use wireless keyboard. Good quality product | Purchased it because of brand HP and 3 yr warrantee on Oct 5, 2024; on Oct 17, 2024 mouse became defective (its scroll button stopped working); contacted 'HP Support' the reply was ""this is an optional accessory, only service center has the option to replace the faulty part"" ; HP accessories are very prone to become defective in a short time - consumers do not prefer to waste  time and petrol in going to service center which again are not customer friendly; three year warrantee is a trap; go for some other better brand (several available on amazon). Key board is working but the mouse is not.  I do not recommend buy. | The battery lasts very long.Key oard doesn't have any led indicators but it works smooth and long term anyway.HP doesn't manufacture them, they're just whitelabled and sold in HP name (try checking the warranty using serial number and you'll know it's not a normal HP product)Mouse is very cheap quality, wouldn't pay 150₹ for it without HP logo. And it also gets stuck many times for some seconds. | Functions as expected. Key nice is less. Mouse pointer is accurate",4.0 out of 5 stars | Previous page | Next page | Previous page | Next page | Previous page of related Sponsored Products | Next page of related Sponsored Products | Previous page of related Sponsored Products | Next page of related Sponsored Products | 4.0 out of 5 stars | Previous page of related Sponsored Products | Next page of related Sponsored Products | Previous page | 3.9 out of 5 stars | 3.7 out of 5 stars | 3.8 out of 5 stars | 4.5 out of 5 stars | 4.1 out of 5 stars | Next page | 4 out of 5 stars | 5.0 out of 5 stars | Previous page | Next page | 3 out of 5 stars | 5.0 out of 5 stars | 4.0 out of 5 stars | 5.0 out of 5 stars | 1.0 out of 5 stars | 5.0 out of 5 stars | 3.0 out of 5 stars | 3.0 out of 5 stars | 4.0 out of 5 stars | 5.0 out of 5 stars,Reviewed in India on 19 October 2024 | Reviewed in India on 15 February 2024 | Reviewed in India on 10 October 2024 | Reviewed in India on 19 August 2024 | Reviewed in India on 11 October 2024 | Reviewed in India on 17 October 2024 | Reviewed in India on 13 August 2023 | Reviewed in India on 9 October 2024,"{'neg': 0.143, 'neu': 0.745, 'pos': 0.112, 'compound': -0.9375}",-0.9375,negative,2
https://www.amazon.in/Essentials-Multi-Purpose-Portable-Wooden-Laptop/dp/B07MSLTW8Z/ref=sr_1_217?qid=1672903006&s=computers&sr=1-217,B07MSLTW8Z,"Gizga Essentials Multi-Purpose Portable & Foldable Wooden Desk for Bed Tray, Laptop Table, Study Table (Black)",Computers&Accessories|Accessories&Peripherals|LaptopAccessories|Lapdesks,"Found 8 reviews, 44 ratings, and 8 dates.","It is very good...long lasting product..can buy it. | Value for the money. A decent looking board with a not-so-cheap looking folder stand. On a hard ground the table is not firm. It is a bit shaky because of the rubber guard at the bottom corner of the stand. It is designed to use over mattress!! I tried it to use as a study table for my school going 12 yr old child. But the width is not sufficient for the folded legs. The space is only designed for the stretched legs. However the height of the table covers for the crossed legs when the legs are streched.  Usage is limited to resting laptops and also as a tray for eating food on the bed. | Didn't Even last for 3month too. | I bought this item for Rs. 549 (sale) (original price as per Amazon is/was Rs.1999 June 11, 2023). The item came in a shrink wrap and a box that did not feel like a brand new item. After removing the shrink wrap, I found mild scratches on the table surface (figure uploaded, check the bottom corner). The edge of the table is made with cheap plastic and displays poor craftsmanship- the plastic is patched up poorly (two figures uploaded to highlight this). The plastic cup holder is a flimsy plastic that does not sit tightly within the groove. The plastic cup holder has a hole that has a plastic ""burr"" (figure uploaded).Amazon will not let me return the item, it will only allow me an exchange, this is frustrating!!I suspect that if I were to return, the exchange item is unlikely to be better. | It’s quite sturdy and compact. Like the top material which looks classy and has a good feel to it. The stand too is neatly painted and has rubberized leg-cornersOverall a good product | It's convenient for remote working guy no problemDont worry about quality it's really strong and its spacious to easily by sitting or lean on the bed | Leg qualities very poor | I picked this table for the price that it was offering i.e. 440/- inr. Coming to the point of usability, no it’s a big no …. It hurts my wrist while working on the laptop since it’s very edgy, you can literally cut an apple with its edge…. Secondly: if you work on bed, it will shake a lot because there’s an foam cushioning wrap around its leg and that makes lil disbalance while working. Thirdly : screws and build quality looks very flimsy, I had to screw-up after two days of my purchase. Fourthly: bottle holder is a + and hold almost any avg size bottle/ mug or even it work like a phone stand as well …. Coming to its length/breadth: I would say it’s enough to hold a laptop of 13” and you’d have enough place to keep your mobile/ mouse pad/ mid size notebook. Just keep in mind it’s very edgy with its corner and will hurt you often.",3.7 out of 5 stars | Previous page of related Sponsored Products | Next page of related Sponsored Products | Previous set of slides | 4.1 out of 5 stars | 4.4 out of 5 stars | 4.3 out of 5 stars | 3.6 out of 5 stars | 4.1 out of 5 stars | 3.9 out of 5 stars | Next set of slides | 3.7 out of 5 stars | Previous page | 4.0 out of 5 stars | 4.3 out of 5 stars | 4.3 out of 5 stars | 3.9 out of 5 stars | 3.9 out of 5 stars | Next page | Previous page of related Sponsored Products | Next page of related Sponsored Products | 3.7 out of 5 stars | 3.9 out of 5 stars | 3.8 out of 5 stars | 4.1 out of 5 stars | 4.2 out of 5 stars | 4.0 out of 5 stars | 3.7 out of 5 stars | 5.0 out of 5 stars | Previous page | Next page | 3 out of 5 stars | 5.0 out of 5 stars | 4.0 out of 5 stars | 4.0 out of 5 stars | 3.0 out of 5 stars | 1.0 out of 5 stars | 1.0 out of 5 stars | 5.0 out of 5 stars | 5.0 out of 5 stars | 5.0 out of 5 stars | 4.0 out of 5 stars | 2.0 out of 5 stars | 2.0 out of 5 stars,Reviewed in India on 12 October 2024 | Reviewed in India on 6 September 2021 | Reviewed in India on 22 August 2024 | Reviewed in India on 11 June 2023 | Reviewed in India on 19 April 2024 | Reviewed in India on 19 April 2024 | Reviewed in India on 18 October 2024 | Reviewed in India on 13 March 2022,"{'neg': 0.095, 'neu': 0.823, 'pos': 0.082, 'compound': -0.7192}",-0.7192,negative,2
https://www.amazon.in/ENVIE-ECR-20-Charger-Rechargeable-Batteries/dp/B00N3XLDW0/ref=sr_1_288?qid=1672903008&s=computers&sr=1-288,B00N3XLDW0,ENVIE ECR-20 Charger for AA & AAA Rechargeable Batteries,Electronics|Cameras&Photography|Accessories|Batteries&Chargers|BatteryChargers,"Found 8 reviews, 33 ratings, and 8 dates.","The product is like having essentials with kids.I was fed up of buying non-rechargeable batteries and they drains like fluid.Buying this product was very helpful as the batteries have a longer life plus it can be charged anywhere.Very useful product. | Good product | I purchased the charger along with a 2800 mAh rechargeable battery from the same brand, but unfortunately, it didn’t work. I’m not sure if the issue lies with the battery or the charger, or perhaps both products are faulty.To be thorough, I even bought a second charger, hoping the first one was defective, but to my disappointment, it still didn’t function. I had high hopes for these products based on their 4-star reviews, but ultimately, it turned out to be a complete waste of my money. | Slow charging of batteries but reliable | Good | ठीक है | The product is money for value but my charger is short-circuit (transformer) only 6 month work | Frustrated, took more than 12 hours and product indicator stopped working after few days",3.6 out of 5 stars | Previous page | Next page | Previous page | Next page | Previous page of related Sponsored Products | Next page of related Sponsored Products | 5 out of 5 stars. | 3.7 out of 5 stars. | 3.6 out of 5 stars | Previous page of related Sponsored Products | Next page of related Sponsored Products | Previous page | 3.2 out of 5 stars | 4.4 out of 5 stars | 4.1 out of 5 stars | 3.4 out of 5 stars | 1.0 out of 5 stars | Next page | 3.6 out of 5 stars | 5.0 out of 5 stars | Previous page | Next page | 1 out of 5 stars | 5.0 out of 5 stars | 4.0 out of 5 stars | 1.0 out of 5 stars | 1.0 out of 5 stars | 3.0 out of 5 stars | 5.0 out of 5 stars | 5.0 out of 5 stars | 4.0 out of 5 stars | 2.0 out of 5 stars,Reviewed in India on 16 August 2024 | Reviewed in India on 2 October 2024 | Reviewed in India on 17 October 2024 | Reviewed in India on 10 April 2024 | Reviewed in India on 14 September 2024 | Reviewed in India on 6 September 2024 | Reviewed in India on 8 August 2024 | Reviewed in India on 20 May 2024,"{'neg': 0.152, 'neu': 0.725, 'pos': 0.122, 'compound': -0.8315}",-0.8315,negative,4
https://www.amazon.in/HP-DeskJet-2723-Wireless-Printer/dp/B08D9MNH4B/ref=sr_1_418?qid=1672903016&s=computers&sr=1-418,B08D9MNH4B,"HP Deskjet 2723 AIO Printer, Copy, Scan, WiFi, Bluetooth, USB, Simple Setup Smart App, Ideal for Home.","Computers&Accessories|Printers,Inks&Accessories|Printers","Found 8 reviews, 29 ratings, and 8 dates.","Very good product as of now, (I bought it just few days back). Worth the money and hope it gives me good service. Connects fast with wifi and the scanner too is of high quality | I purchased the HP Deskjet 2820 Wired Colour Home Inkjet Printer recently, expecting a reliable and efficient printing solution for light home use. The printer seemed to tick all the right boxes with its compact design and advertised specifications. However, after using it for a while, my experience has been worst.1. Low Page Yield: Although the product description promises a duty cycle of up to 1000 pages per month, my total output (both B&W and color) was around 220 pages before the ink ran out. This was far below expectations. Even for light home use, I expected at least 400-500 pages per cartridge set.2. High Ink Consumption: The ink cartridges seem to deplete very quickly, especially when printing color documents. This makes it costly to maintain, as you’ll need frequent refills or replacements.3. Noisy Operation: The printer can get a bit noisy during operation, which isn’t a deal-breaker but is noticeable. | The black ink cartridge  that came with it was faulty and wasn’t being recognised | Amazing printer with easy to use 👌 | The 805 starter cartridge can at most print 10 pages. So, in theory, enough for you to print the alignment page and get the page scan for head alignment. Guess what, it does not even print a single page. If you are expecting any help - HP support did send someone around because I wanted to check if there is no issue with the print head. The engineer did visit and confirm and now I have ordered 805XL cartridges from HP (o not buy it from elsewhere including this vendor because third party cartridges will be rejected and you will ose your money). Instead, buy two sets and then refill them and the printer memory will not detect that this was used before. | Does printing, scanning and copy very well | WORST, WORST, WORST PRINTER AND COMPANY. I am a person who has never spent so much time on writing a review. But I am forced to. The worst printer and the worst support I have ever received. Everyday I am spending so much time to resolve one or the other issue. Now I feel the only thing HP wants is all my personal details during set up, no help after that. It has given me problems only from the first day. It took so much time to install. Once installed, when I started taking print, the paper will reach halfway to the cartridge and then will show stuck. Everytime I have to turn off the printer and restart it to print the page. I need to repeat it after every sheet.  It was resolved accidentally when my paper sheet was over and I purchased the best GSM paper from the market. Till that time, I did not receive any solution from Hp or from any other source. After that, when I was taking a print urgently, the margins of the printer never come properly as shown in the softcopy of the PDF. I took so many prints after changing the paper option to A4, letter and legal. Same results. Only after I changed the position of the paper and put it to one side of the tray, did the print come properly.  First time I am encountering a printer, for which you can put paper in different positions in the tray for the print to come properly. Usually you put the paper in the up or down tray and the print comes properly. Now I am using another wifi, not the previous one. You can scan by connecting the USB cable, but it never prints. I checked multiple sites including HP help to change my wifi. I tried multiple suggestions given, but none works out. Also, I purchased a new black cartridge from Amazon online and connected it properly, but the cartridge status shows a red light. Dont know why.  I have used printers in India and abroad, both laser and inkjet. HP printers were always notorious for installation, but never gave me this much trouble. Brother laser printers were always my best bet. But, since I needed this printer only for a short time, I purchased the less costly printer. | Little costly but very simple to use and light weight printer and scanner. For home use I bought and as of now working fine",3.5 out of 5 stars | Previous page of related Sponsored Products | Next page of related Sponsored Products | Previous page | Next page | 3.5 out of 5 stars | Previous page of related Sponsored Products | Next page of related Sponsored Products | Previous page | 4.0 out of 5 stars | 3.9 out of 5 stars | 4.6 out of 5 stars | 3.8 out of 5 stars | 3.8 out of 5 stars | Next page | 3.5 out of 5 stars | 5.0 out of 5 stars | Previous page | Next page | 4 out of 5 stars | 5.0 out of 5 stars | 1.0 out of 5 stars | 4.0 out of 5 stars | 5.0 out of 5 stars | 3.0 out of 5 stars | 5.0 out of 5 stars | 1.0 out of 5 stars | 4.0 out of 5 stars | 4.0 out of 5 stars,Reviewed in India on 17 October 2024 | Reviewed in India on 18 October 2024 | Reviewed in India on 9 July 2024 | Reviewed in India on 20 October 2024 | Reviewed in India on 18 January 2024 | Reviewed in India on 20 October 2024 | Reviewed in India on 24 March 2021 | Reviewed in India on 9 May 2024,"{'neg': 0.092, 'neu': 0.817, 'pos': 0.09, 'compound': -0.8161}",-0.8161,negative,2
