url,product_id,product_name,product_category,summary,reviews,ratings,dates,sentiment_scores,compound,sentiment,topic
https://www.amazon.in/Artis-AR-45WMG2-Compatible-Laptop-Adaptor/dp/B07L1N3TJX/ref=sr_1_432?qid=1672903016&s=computers&sr=1-432,B07L1N3TJX,"Artis AR-45W-MG2 45 Watts MG2 Laptop Adapter/Charger Compatible with MB Air 13” & MB Air 11” (14.5 V, 3.1 A) Connector: MG2 (T Tip Connector)",Computers&Accessories|Accessories&Peripherals|LaptopAccessories|LaptopChargers&PowerSupplies,"Found 8 reviews, 39 ratings, and 8 dates.","its not original but work fine | NOT AT ALL A SAFE and DURABLE PRODUCT !!After 6 months of use, this charger is showing problems. After a while the charging stops completely. The light becomes on and off while charging.The wire becomes extremely HOT. The tip becomes so HOT that you cant even touch it and it probably might even burn some clothes, if the laptop is kept on a bed.I am scared that this Artis charger will permanently damage my Macbook too.Users please note this warning before buying this product.Also, for the warranty we have to find their nearby store/service-center, which will be very hard, given this brand is not popular. Not worth the hassle. | So I bought this product a month back because my old wire was done and I wanted a new one. But I didn't want to spend the insane 7-8K for an authentic MacBook charger because my device is already 7-8 years old.But since I had to buy one I chose this.The first one that was delivered to me didn't work properly. It would go green and then orange light indicating that it was charging but it wasn't actually charging.Within a day I received a new charger though and it's been working just fine.I am definitely not testing it like crazy and I keep it plugged in one place but it works and I am happy it does. It is very reassuring.I will update this review after a few more months of usage. But up until now there's no issues that I can see. Charging seems to happen quickly and I don't think it heats up.I would totally recommend it but I would also suggest checking the product.P.S. - 4 stars because the first product I received didn't work. | Perfect specifications to replace the adaptor of my 13"" Mac Book Pro Retina 2015 laptop. Input  AC 100-250V Output 16.5V / 3.65 A.Charged my laptop perfectly. No overheating or other issues observed.Build quality appears same as that of a regular mac charger.The only difference is that you cannot unclip and remove the two pin plug in the front which is built in.The box mentions that it is BIS Certified and compatible with Mac Book Pro Retina 13"" 2012, 2013, 2014 & 2015.Arrived within a few hours of ordering. Neatly packed.If you need a replacement adapter go for it! I would recommend it without any hesitation. | This charger is not durable. Went off after a few months of using. Initially was working well but not long lasting. | The charger worked fine for first two days and then it stopped working.The indicator doesn’t light up, and the laptop shows the charging to be ON, but there is no charging happening.Now there is no way to replace as I didn’t preserve the box. All money wasted. | Exceedingly economical when compared to the original charger.It does the job satisfactorily, gets warm slightly more than the original but nothing to be concerned about.I just wrote it because some user shared their experience that it gets hot, and I was concerned because of this.I use it for 17-18 hours daily and sometimes by mistake it gets left on overnight as well.  But it never gets hot, it remains between normal to slightly warm.No issues with compatibility.It also senses the device that connects to it because when I charge my mobile,  the output gets tuned to that. | I am all over satisfied with this charger.Pro = It is a charger for Macbooks and it works perfectly fine as it should be.The quality of the material is also good enough but not like the original one ofcourse.Cons = It takes a long time to charge than the original one, but not so long, so I think it is manageable.",3.4 out of 5 stars | Previous page | Next page | Previous page | Next page | Previous page of related Sponsored Products | Next page of related Sponsored Products | Previous page of related Sponsored Products | Next page of related Sponsored Products | 3.4 out of 5 stars | 3.6 out of 5 stars | 4.3 out of 5 stars | 3.5 out of 5 stars | 4.0 out of 5 stars | 3.8 out of 5 stars | 3.4 out of 5 stars | Previous page of related Sponsored Products | Next page of related Sponsored Products | Previous page | 3.9 out of 5 stars | 4.2 out of 5 stars | 4.4 out of 5 stars | 4.0 out of 5 stars | 3.6 out of 5 stars | Next page | 3.4 out of 5 stars | 5.0 out of 5 stars | Previous page | Next page | 5 out of 5 stars | 5.0 out of 5 stars | 1.0 out of 5 stars | 4.0 out of 5 stars | 5.0 out of 5 stars | 5.0 out of 5 stars | 3.0 out of 5 stars | 1.0 out of 5 stars | 5.0 out of 5 stars | 4.0 out of 5 stars,Reviewed in India on 16 October 2024 | Reviewed in India on 10 September 2024 | Reviewed in India on 27 January 2021 | Reviewed in India on 13 September 2024 | Reviewed in India on 3 April 2024 | Reviewed in India on 8 October 2024 | Reviewed in India on 15 January 2024 | Reviewed in India on 30 April 2024,"{'neg': 0.112, 'neu': 0.792, 'pos': 0.097, 'compound': -0.7319}",-0.7319,negative,0
https://www.amazon.in/Prestige-1-5-Kettle-1500-watts-Red/dp/B07VNFP3C2/ref=sr_1_16?qid=1672923591&s=kitchen&sr=1-16,B07VNFP3C2,"Prestige 1.5 Litre Kettle 1500-watts, Red",Home&Kitchen|Kitchen&HomeAppliances|SmallKitchenAppliances|Kettles&HotWaterDispensers|ElectricKettles,"Found 8 reviews, 42 ratings, and 8 dates.","Very good quality product, steel is also thick, auto cut off is working fine, colour is very impressive, heat up water very quickly,Overall value for money product, | Good product | Working properly | This product was purchased for my elderly parents for them to heat water for their drinking and cooking purpose. We have been using electric kettles for the last 15 plus years. This time around the brand was prestige so I was not very worried about the durability, unfortunately what happened was that the auto switch off function did not work and the kettle went on heating the water after which it stopped functioning. When I went home to visit my parents and saw that the product has failed I tried to look for a service Center to claim warranty and fix the issue, could not find the service Center in Manipal and hence ended up taking it to a local electric repair shop. They changed the switch and yet the auto switch off function is not working. I ended up buying locally another electric kettle and this brand new piece is now just lying there at home without a solution. I’d appreciate if TTK prestige did offer me a solution for the same. | Prestige products are good. But in online delivery through Amazon. Defective piece was delivered | I want cash on delivery on every order please | The handle  gets hot after boil | All that you need in a kettle .. it is steel so no plastic leeching",3.9 out of 5 stars | Previous page | Next page | Previous page | Next page | Previous page | 3.9 | 4.3 | 3.8 | Next page | 3.4 | 3.4 | 3.1 | Previous page of related Sponsored Products | Next page of related Sponsored Products | Previous page | 4.0 out of 5 stars | 3.5 out of 5 stars | 4.5 out of 5 stars | 3.7 out of 5 stars | 4.4 out of 5 stars | Next page | Previous page of related Sponsored Products | Next page of related Sponsored Products | 3.9 out of 5 stars | 4.4 out of 5 stars | 4.4 out of 5 stars | 4.0 out of 5 stars | 3.9 out of 5 stars | 5.0 out of 5 stars | Previous page | Next page | 4 out of 5 stars | 5.0 out of 5 stars | 5.0 out of 5 stars | 4.0 out of 5 stars | 5.0 out of 5 stars | 1.0 out of 5 stars | 3.0 out of 5 stars | 5.0 out of 5 stars | 4.0 out of 5 stars | 5.0 out of 5 stars,Reviewed in India on 15 October 2024 | Reviewed in India on 9 October 2024 | Reviewed in India on 13 October 2024 | Reviewed in India on 12 August 2024 | Reviewed in India on 2 October 2024 | Reviewed in India on 14 October 2024 | Reviewed in India on 8 October 2024 | Reviewed in India on 9 October 2024,"{'neg': 0.082, 'neu': 0.842, 'pos': 0.076, 'compound': -0.3837}",-0.3837,negative,4
https://www.amazon.in/Bajaj-Shakti-Heater-Multiple-Safety/dp/B097R45BH8/ref=sr_1_30?qid=1672923592&s=kitchen&sr=1-30,B097R45BH8,"Bajaj New Shakti Neo 15L Vertical Storage Water Heater (Geyser 15 litres) 4 Star BEE Rated Heater For Water Heating with Titanium Armour, Swirl Flow Technology, Glasslined Tank (White), 1 Yr Warranty","Home&Kitchen|Heating,Cooling&AirQuality|WaterHeaters&Geysers|StorageWaterHeaters","Found 8 reviews, 44 ratings, and 8 dates.","Great product | Just received but for handing on wall .. no nuts/ screws , nothing is provided in box .. thinking how to install 🥲 | .using it daily. Water capacity is 10 liters. Attractive  plug pipe quality is good..white colour is very nice. Takes 10 minutes for hot water | The media could not be loaded.
                
            
                
            
            
        
    
    








  
  
    I had purchased a geyser in late 2021 and it hasn't been used much. Now, it wasn't switching on during October 2023. So, when the technician visited on 16th Oct, he promptly took Rs 350 as service charge and said that Geyser tank has an issue and it needs to be replaced. I told him to do it as soon as possible as winter was about to start. He told that it would take 2 weeks maximum as it was an online purchase. But, insisted that it would be done by 2 weeks and we should not worry.Now, I received another call, directly from Service centre on 20th Oct. The person stated that replacement request has been accepted. I would receive the product by 1 week.5 days later (on 25th Oct), I called the service centre around 1:40 pm - No one picked the call.I again called at 6:30 pm multiple times. Finally, one person picked and he said that since you didn't receive Replacement tag on whatsapp, it will take more time. I asked about why do I need the tag, it's them to receive it and come with the replacement product and install it. However, they said that they cannot do anything. Also, they said that tag was generated a few days back and since I didnt follow up with them, so it was not sent. Sounds ridiculous right. I asked them to share the tag now which they again unnecessarily delayed till next day evening. Also, I had called them multiple times. That day (26th Oct), they confirmed again that it will take a week to replace the product.Now, again I followed up yesterday (2nd Nov). They didn't pick up and call and just read all my whatsapp messages but didn't respond.Today( 3rd Nov) I received a call from the technician who had visited on the first day. He said that it will take another 7 days. He was extremely rude and when I asked him to listen to my words as well, he disconnected the call. RIDICULOUS behaviour !!!Bajaj product quality can be seen in the image/video attached. It looks like a refurbished product with very old parts. Utterly PATHETIC product and extremely DISGUSTING service. They are not able to send a replacement in almost 3 weeks but able to send new deliveries in a day or two.I would suggest other buyers to refrain from buying Bajaj products. If at all you want to buy one, do it offline. Atleast, you know the seller.Btw, thanks Bajaj for wasting my time and energy. Your product and service centre guys are MISERABLE. Additionally, your call centre team is clueless. They only say one thing that the buyer needs to directly talk and deal with service centre. Simply no ownership.Finally, I bought another Racold geyser and still waiting for the wretched Bajaj team to resolve the issue. Sad story of a customer._________________________I kept folowing up and no one was picking the call or reverting on messages. Just silently reading my whatsapp messages. Once I did whatsapp call on 10th Nov and they picked it by mistake. I asked that you have told during our last communication (which was 3rd Nov) that it would be installed in a week. Any progress ?? He just randomly told that it would be done today or max tomorrow as now the bill has also been generated from Bajaj side. And, he disconnected the call.Again, no progress for 6 days. Out of frustration, I called him again in early morning on Nov 16th. He picked by mistake and enquired who am I. The moment he realized, he told to call me after 11am. Then I called the technician who had originally visited and told that product would be replaced in 10-15 days. Finally, they agreed to install the replacement order on next day.So, on 17th Dec ( more than a month), the replacement geyser was installed. They kept saying that this delay was due to Diwali. I told them that the replacement tag was generated on 19th Nov and by no means Diwali was celebrated for 29 days. Anyways, I understood that Bajaj service is extremely PATHETIC when you are trying to claim anything under guarantee. So, please do not purchase Bajaj products online. This is my ordeal. | Quick delivery. I am happy with the product. It storage capacity it is good for family size of 2-4.Heating speed is good and ease to use thorough switch. | Useful for small family or single use .As needs to reheat after 1 bucket water | The media could not be loaded.
                
            
                
            
            
        
    
    








  
  
    The product was installed today, on time installation and very fast product delivery but installation is bit costlier so be prepared for same.I was charged 350₹ for installation, pipe for 230₹ and adjustable valve for 550₹ approx 1130₹ for installation. Bajaj must have kept this pricing fix and when i called bajaj for price confirmation they say you need to talk with technician we dont know charges.Charges in your area may differ bit | Awesome",4.1 out of 5 stars | Previous page | Next page | Previous page | Next page | 3.8 stars | Previous page | 4.0 | 4.2 | Next page | Previous page of related Sponsored Products | Next page of related Sponsored Products | 4 out of 5 stars. | 3.8 out of 5 stars. | 4 out of 5 stars. | Previous page | 4.3 out of 5 stars | 4.0 out of 5 stars | 3.6 out of 5 stars | 3.5 out of 5 stars | 3.8 out of 5 stars | Next page | Previous page of related Sponsored Products | Next page of related Sponsored Products | 4.1 out of 5 stars | 4.3 out of 5 stars | 4.4 out of 5 stars | 4.2 out of 5 stars | 4.4 out of 5 stars | 4.2 out of 5 stars | 4.1 out of 5 stars | 5.0 out of 5 stars | Previous page | Next page | 1 out of 5 stars | 5.0 out of 5 stars | 4.0 out of 5 stars | 5.0 out of 5 stars | 1.0 out of 5 stars | 1.0 out of 5 stars | 5.0 out of 5 stars | 4.0 out of 5 stars | 3.0 out of 5 stars | 5.0 out of 5 stars,Reviewed in India on 17 October 2024 | Reviewed in India on 5 October 2024 | Reviewed in India on 20 October 2024 | Reviewed in India on 3 November 2023 | Reviewed in India on 17 September 2024 | Reviewed in India on 19 September 2024 | Reviewed in India on 9 March 2024 | Reviewed in India on 17 October 2024,"{'neg': 0.086, 'neu': 0.825, 'pos': 0.089, 'compound': -0.4437}",-0.4437,negative,2
https://www.amazon.in/Pigeon-Healthifry-Circulation-Technology-Non-Stick/dp/B0B8XNPQPN/ref=sr_1_44?qid=1672923592&s=kitchen&sr=1-44,B0B8XNPQPN,"Pigeon Healthifry Digital Air Fryer, 360° High Speed Air Circulation Technology 1200 W with Non-Stick 4.2 L Basket - Green",Home&Kitchen|Kitchen&HomeAppliances|SmallKitchenAppliances|DeepFatFryers|AirFryers,"Found 8 reviews, 43 ratings, and 8 dates.","Used for 10-12 times each for half hour. No problems so far. 🤞. Buttoms are simple, quantity is ok for home use, build quality is fine, not sturdy. | I bought this Pigeon Air fryer in july 2023, it work well for 1 month ..after that started giving problems and within 45 days product stopped working...Flipkart takes no responsibility of product exchange or warranty at all..even i have purchased extended warranty for this product bt its useless...U have to call there toll free no 100's of time just to get in touch with executive...they dont have any dedicated service center in metro city like bombay ..they will share part time engineer no. who will repair this product on behalf of company ...Engineer himself deny and ask not to bring this product to him , they dont have parts...Pigeon Company takes no responsibility of product quality ,repair and maintenance ...WORST SERVICE WORST PRODUCTMy two friends bought same product facing same issue...no response from company at all...waste of money...go for other brands with good build quality and after sales service.THANK YOU | The media could not be loaded. | Nice color and price | Easy to use and works well. I’ve been using this daily since i bought it. Great for heating samosas, cooking marinated meat, making crispy vegetables, French fries etc | 1. The item supplied was defective. While closing the tray atleast 5-10 times, the digital display used to light up once if I was lucky, and then stopped working altogether.2. 2-3 small parts have already broken after 1 use.3. The inside of the tray is getting discolored even after using silicon moulds to protect it.4. The customer service is non-existent. The telephone no. given dors-not.On a side note, pigeon pressure cookers are also the cheapest in the market as they are prone to bursting.Worthless fraud company...please stock to brands who prioritise quality and have a minimum customer support service. | Handle outer body keep coming out-Design flaw, closing last piece was extremely tight so had to replace but still not very smooth. Just average product. | This air fryer will not dissapoint in any way. The only cons is its build quality. The paint on basket start peeling off & rust if used roughly. Use silicon liners to reduce the need for washing basket.",3.7 out of 5 stars | Previous page | Next page | Previous page | Next page | Previous page | 4.4 | 4.2 | 3.7 | 4.4 | Next page | Previous page of related Sponsored Products | Next page of related Sponsored Products | Previous page | 4.7 out of 5 stars | 4.6 out of 5 stars | 4.2 out of 5 stars | 4.5 out of 5 stars | 4.2 out of 5 stars | Next page | Previous page of related Sponsored Products | Next page of related Sponsored Products | 3.7 out of 5 stars | 4.4 out of 5 stars | 4.4 out of 5 stars | 4.2 out of 5 stars | 4.3 out of 5 stars | 4.0 out of 5 stars | 3.7 out of 5 stars | 5.0 out of 5 stars | Previous page | Next page | 4 out of 5 stars | 5.0 out of 5 stars | 5.0 out of 5 stars | 1.0 out of 5 stars | 4.0 out of 5 stars | 5.0 out of 5 stars | 5.0 out of 5 stars | 1.0 out of 5 stars | 3.0 out of 5 stars | 4.0 out of 5 stars | 4.0 out of 5 stars,Reviewed in India on 14 October 2024 | Reviewed in India on 27 September 2024 | Reviewed in India on 11 October 2024 | Reviewed in India on 18 October 2024 | Reviewed in India on 4 October 2024 | Reviewed in India on 1 October 2024 | Reviewed in India on 4 October 2024 | Reviewed in India on 3 October 2024,"{'neg': 0.082, 'neu': 0.849, 'pos': 0.069, 'compound': -0.4353}",-0.4353,negative,2
https://www.amazon.in/Havells-Cista-room-Heater/dp/B078KRFWQB/ref=sr_1_52?qid=1672923593&s=kitchen&sr=1-52,B078KRFWQB,"Havells Cista Room Heater, White, 2000 Watts","Home&Kitchen|Heating,Cooling&AirQuality|RoomHeaters|ElectricHeaters","Found 8 reviews, 49 ratings, and 8 dates.","Good quality | 2019- Good quality but expensive.22Dec2021 - bought another piece for second room but this time had to finally return the product after trying exchange two times. First time high blower noise and thermostat faulty - no auto cutoff. Second time - still no auto cuto off.Don't know what happened to QC of these blowers by Havells. | Used the product for around four months in Chandigarh. The room was sufficiently hot when the outside temperature was falling to around 6°C. In fact, sometimes the room went too hot and we had to turn the knob from ""Hot"" to ""Warm"". There is a continuous temperature control knob which got a bit defective (loose connection), but other than that, the thing is worked fine. Value for money. | 1. Out side body is plastic and it gets heated when the heater is ON2. Heating is not up to mark, it doesn't get heated quickly.3. Consumes more power, since the coil takes too much time to heat.Overall, not good product as room heater.I do not see any positive thing in this product. | Auto cut facility is there, work like hot air blower. Very high power consumption.Not a room heater, work only for nearest sitting area. | Nice product after 2 month review , one slight issue "" kabhi kabhi sound aane lagta hai vibration jaisa , "" but heating wise good. | It's good for winter to get rid of cold temperatures in a room. It will make room hot soon | बहुत बढ़िया लेकिन पंखे की स्पीड कम होने के कारण रूम को गर्म करने में समय लगता है कम से कम 1 से २ घंटा और मीटर यूनिट घोड़े से भी तेज भागता है मीटर की रीडिंग देखकर आपको हार्ट अटैक भी आने के चांस है इसलिए ज्यादा देर तक बिलकुल भी न चलाए वरना आपके पॉकेट ढीली हो सकती हैं।",3.8 out of 5 stars | Previous page | Next page | 3.5 | 3.4 | 3.1 | 3.1 | 3.8 out of 5 stars | 4.0 out of 5 stars | Previous page of related Sponsored Products | Next page of related Sponsored Products | 4 out of 5 stars. | 3.8 out of 5 stars. | 4 out of 5 stars. | Previous set of slides | 4.0 out of 5 stars | 4.0 out of 5 stars | 3.7 out of 5 stars | 3.9 out of 5 stars | 3.9 out of 5 stars | 3.9 out of 5 stars | Next set of slides | Previous page | 4.1 out of 5 stars | 3.6 out of 5 stars | 4.1 out of 5 stars | 4.1 out of 5 stars | Next page | Previous page of related Sponsored Products | Next page of related Sponsored Products | 3.8 out of 5 stars | 3.9 out of 5 stars | 4.3 out of 5 stars | 4.0 out of 5 stars | 3.7 out of 5 stars | 4.1 out of 5 stars | 3.8 out of 5 stars | 5.0 out of 5 stars | Previous page | Next page | 3 out of 5 stars | 5.0 out of 5 stars | 4.0 out of 5 stars | 5.0 out of 5 stars | 1.0 out of 5 stars | 3.0 out of 5 stars | 5.0 out of 5 stars | 4.0 out of 5 stars | 5.0 out of 5 stars,Reviewed in India on 13 May 2024 | Reviewed in India on 5 February 2020 | Reviewed in India on 19 July 2022 | Reviewed in India on 13 July 2024 | Reviewed in India on 4 February 2023 | Reviewed in India on 11 February 2024 | Reviewed in India on 18 February 2024 | Reviewed in India on 21 January 2023,"{'neg': 0.093, 'neu': 0.845, 'pos': 0.062, 'compound': -0.8709}",-0.8709,negative,3
